{
  "schemaVersion": "repair-work-order.v1",
  "workOrderId": "11111111-1111-4111-8111-111111111111",
  "tenantId": "22222222-2222-4222-8222-222222222222",
  "requesterPersonId": "33333333-3333-4333-8333-333333333333",
  "deviceId": "44444444-4444-4444-8444-444444444444",
  "status": "repairer_submitted",
  "symptoms": ["battery_drain"],
  "description": "충전 후 사용 시간이 짧아졌어요.",
  "attachmentRefs": [],
  "priority": "soon",
  "assignmentMode": "center_assigned",
  "repairStationId": "55555555-5555-4555-8555-555555555555",
  "repairerPersonId": "66666666-6666-4666-8666-666666666666",
  "quotedAmountKrw": 120000,
  "billedAmountKrw": 110000,
  "subsidyReservedKrw": 90000,
  "submittedAt": "2026-08-13T06:00:00Z",
  "createdAt": "2026-08-12T03:00:00Z",
  "updatedAt": "2026-08-13T06:00:00Z",
  "revision": 5
}
